{
  "case_id": "D06",
  "decision_status": "provisional_assessment",
  "decision_status_reason": "The client has specified the material (petroleum stream), the measurement quantity (water content), and the desire for a fiber-based measurement closer to the process. This supports a provisional assessment for in-line spectroscopy methods.",
  "requirements": {
    "stated": [
      "The client handles a petroleum stream.",
      "Samples are currently sent to a laboratory for water determination.",
      "The client wants to investigate a fiber-based measurement closer to the process.",
      "The analyzer would be outside the process area."
    ],
    "unknowns": [
      {
        "item": "Specific type of fiber-optic spectroscopy to be used",
        "why_it_matters": "Different types of spectroscopy (e.g., NIR, Raman) have different capabilities and limitations for detecting water content."
      },
      {
        "item": "Exact location and environmental conditions of the analyzer",
        "why_it_matters": "Environmental conditions can affect the performance and durability of the equipment."
      },
      {
        "item": "Required sensitivity and accuracy for water detection",
        "why_it_matters": "Determines the specifications needed for the equipment to meet process requirements."
      },
      {
        "item": "Integration requirements with existing systems",
        "why_it_matters": "Ensures compatibility and seamless operation with current process controls."
      }
    ],
    "assumptions": [
      "The client is looking for real-time or near real-time water content measurement.",
      "The fiber-optic measurement system will be used to detect changes in water content more quickly than the current laboratory method."
    ]
  },
  "clarification_questions": [
    {
      "priority": 1,
      "question": "What is the required sensitivity and accuracy for water detection in the petroleum stream?",
      "could_change": "method"
    },
    {
      "priority": 2,
      "question": "What are the environmental conditions at the analyzer's location?",
      "could_change": "probe_or_geometry"
    },
    {
      "priority": 3,
      "question": "Are there specific integration requirements with existing systems?",
      "could_change": "experiment_design"
    },
    {
      "priority": 4,
      "question": "What is the expected range of water content in the petroleum stream?",
      "could_change": "method"
    },
    {
      "priority": 5,
      "question": "Is there a preferred type of spectroscopy (e.g., NIR, Raman) already considered?",
      "could_change": "method"
    }
  ],
  "recommendations": [
    {
      "method": "MIR_ATR",
      "role": "primary_candidate",
      "rationale": "MIR-ATR spectroscopy is effective for detecting water content in petroleum, as shown by its use in similar applications.",
      "applies_when": "The petroleum stream can be accessed for ATR probe insertion and the water content is within the detectable range of MIR.",
      "confidence": "medium",
      "citations": [
        {
          "source_id": "S02",
          "page": 13,
          "supports": "ATR probes with ZrO2 tips can be used for water content measurement in petroleum."
        }
      ]
    },
    {
      "method": "NIR",
      "role": "comparison_candidate",
      "rationale": "NIR spectroscopy is commonly used for online analysis and can detect water content through transmission or transflection probes.",
      "applies_when": "The petroleum stream is suitable for NIR transmission or transflection measurements.",
      "confidence": "medium",
      "citations": [
        {
          "source_id": "S01",
          "page": 5,
          "supports": "NIR spectroscopy allows for online applications, including remote measurements via fiber optic probes."
        }
      ]
    }
  ],
  "measurement_concept": {
    "summary": "The measurement will likely involve an ATR probe for MIR spectroscopy or a transmission/transflection probe for NIR spectroscopy, with the analyzer located outside the process area.",
    "geometry": "undetermined",
    "fiber_link_note": "The fiber link will need to be defined based on the chosen method and environmental conditions.",
    "needs_afs_confirmation": true,
    "citations": [
      {
        "source_id": "S02",
        "page": 13,
        "supports": "ATR probes with ZrO2 tips can be used for water content measurement in petroleum."
      },
      {
        "source_id": "S01",
        "page": 5,
        "supports": "NIR spectroscopy allows for online applications, including remote measurements via fiber optic probes."
      }
    ]
  },
  "spectral_range": [
    {
      "method": "MIR_ATR",
      "status": "nominal_only",
      "note": "MIR-ATR is effective for detecting water content in petroleum streams.",
      "nominal_range": {
        "min": 4000,
        "max": 2000,
        "unit": "cm-1"
      },
      "citations": [
        {
          "source_id": "S02",
          "page": 13,
          "supports": "ATR probes with ZrO2 tips can be used for water content measurement in petroleum."
        }
      ]
    },
    {
      "method": "NIR",
      "status": "nominal_only",
      "note": "NIR spectroscopy is suitable for detecting water content through transmission or transflection.",
      "nominal_range": {
        "min": 780,
        "max": 2500,
        "unit": "nm"
      },
      "citations": [
        {
          "source_id": "S01",
          "page": 5,
          "supports": "NIR spectroscopy allows for online applications, including remote measurements via fiber optic probes."
        }
      ]
    }
  ],
  "risks": [
    {
      "risk": "Environmental conditions may affect probe performance.",
      "mitigation": "Select probes and fibers rated for the specific environmental conditions.",
      "citations": [
        {
          "source_id": "S01",
          "page": 5,
          "supports": "NIR spectroscopy allows for online applications, including remote measurements via fiber optic probes."
        }
      ]
    },
    {
      "risk": "Integration with existing systems may be complex.",
      "mitigation": "Conduct a detailed integration study to ensure compatibility.",
      "citations": [
        {
          "source_id": "S01",
          "page": 5,
          "supports": "NIR spectroscopy allows for online applications, including remote measurements via fiber optic probes."
        }
      ]
    }
  ],
  "feasibility_plan": {
    "objective": "To establish the feasibility of in-line water content measurement in petroleum using fiber-optic spectroscopy.",
    "samples_or_process_states": [
      "Petroleum stream with varying water content."
    ],
    "reference_measurements": [
      "Laboratory water determination methods."
    ],
    "comparisons": [
      "Compare MIR-ATR and NIR methods for water detection."
    ],
    "steps": [
      "Define the environmental conditions and integration requirements.",
      "Select appropriate probes and fibers for MIR-ATR and NIR.",
      "Conduct initial tests to compare sensitivity and accuracy against laboratory results."
    ],
    "go_no_go_basis": "The method must demonstrate comparable or superior sensitivity and accuracy to the current laboratory method."
  },
  "source_conflicts": [],
  "meta": {
    "model": "gpt-4o",
    "kb_version": "kb-e5505ad92bbc",
    "generated_at": "2026-10-17T09:16:08.987712+00:00",
    "verification": {
      "citations_ok": true,
      "range_check_ok": true,
      "unsupported_numbers": [],
      "warnings": []
    }
  }
}
