{
  "case_id": "D02",
  "decision_status": "provisional_assessment",
  "decision_status_reason": "The client has specified the material (concentrated milk), the process (flowing through a line), and the quantities to measure (fat and protein), allowing for a provisional assessment of suitable spectroscopy methods.",
  "requirements": {
    "stated": [
      "The product is an opaque, concentrated milk product.",
      "The product flows through a processing line.",
      "The product is currently sampled for fat and protein analysis.",
      "The product's temperature and texture vary during production.",
      "The client wants earlier information about composition changes.",
      "The client wants to retain laboratory checks."
    ],
    "unknowns": [
      {
        "item": "Specific wavelengths or spectral range of interest",
        "why_it_matters": "Determines the type of spectroscopy method and equipment needed."
      },
      {
        "item": "Acceptable level of accuracy and precision for in-line measurements",
        "why_it_matters": "Influences the choice of technology and calibration requirements."
      },
      {
        "item": "Flow rate of the product in the processing line",
        "why_it_matters": "Affects the design of the in-line measurement setup and sensor placement."
      },
      {
        "item": "Exact nature of the texture variations",
        "why_it_matters": "Could impact the interaction of light with the product and the choice of measurement technique."
      }
    ],
    "assumptions": [
      "The client is considering in-line spectroscopy as a method for obtaining earlier information about composition changes.",
      "The client is open to conducting a practical comparison experiment to evaluate spectroscopy methods."
    ]
  },
  "clarification_questions": [
    {
      "priority": 1,
      "question": "What is the acceptable level of accuracy and precision for in-line measurements?",
      "could_change": "method"
    },
    {
      "priority": 2,
      "question": "What is the flow rate of the product in the processing line?",
      "could_change": "probe_or_geometry"
    },
    {
      "priority": 3,
      "question": "Can you describe the exact nature of the texture variations during production?",
      "could_change": "method"
    },
    {
      "priority": 4,
      "question": "Are there any specific wavelengths or spectral ranges of interest for the analysis?",
      "could_change": "spectral_range"
    }
  ],
  "recommendations": [
    {
      "method": "NIR",
      "role": "primary_candidate",
      "rationale": "NIR spectroscopy is suitable for analyzing opaque and concentrated dairy products like milk, providing information on fat and protein content through diffuse reflection.",
      "applies_when": "The product is opaque and concentrated, and the client seeks to monitor fat and protein content.",
      "confidence": "medium",
      "citations": [
        {
          "source_id": "S01",
          "page": 17,
          "supports": "NIR Reflection is primarily used for opaque or highly concentrated dairy products."
        }
      ]
    },
    {
      "method": "Raman",
      "role": "comparison_candidate",
      "rationale": "Raman spectroscopy can complement NIR by providing additional molecular information, though it may be affected by fluorescence from the milk matrix.",
      "applies_when": "Additional molecular information is needed, and fluorescence interference is manageable.",
      "confidence": "medium",
      "citations": [
        {
          "source_id": "S01",
          "page": 5,
          "supports": "Raman spectra carry complementary qualitative and quantitative information about the sample's composition."
        }
      ]
    }
  ],
  "measurement_concept": {
    "summary": "NIR diffuse reflection probe mounted in-line to monitor fat and protein content in the flowing milk product.",
    "geometry": "diffuse_reflection",
    "fiber_link_note": "Fiber optics enable remote analysis, reducing interference from environmental conditions.",
    "needs_afs_confirmation": true,
    "citations": [
      {
        "source_id": "S01",
        "page": 17,
        "supports": "NIR Reflection is primarily used for opaque or highly concentrated dairy products."
      }
    ]
  },
  "spectral_range": [
    {
      "method": "NIR",
      "status": "nominal_only",
      "note": "NIR is suitable for monitoring fat and protein in dairy products.",
      "nominal_range": {
        "min": 780,
        "max": 2500,
        "unit": "nm"
      },
      "citations": [
        {
          "source_id": "S01",
          "page": 10,
          "supports": "NIR spectra (780–2500 nm) contain predominantly overtones and component bands of fundamental vibrations."
        }
      ]
    },
    {
      "method": "Raman",
      "status": "nominal_only",
      "note": "Raman can provide complementary information but may be affected by fluorescence. Excitation wavelength to be defined with the expert.",
      "citations": [
        {
          "source_id": "S01",
          "page": 11,
          "supports": "Raman spectroscopy is based on recording weak radiation signals observed when a sample is irradiated by a laser."
        }
      ]
    }
  ],
  "risks": [
    {
      "risk": "Variations in product texture and temperature may affect measurement accuracy.",
      "mitigation": "Calibrate the system under varying conditions and use chemometric models to account for changes.",
      "citations": [
        {
          "source_id": "S01",
          "page": 5,
          "supports": "Chemometric algorithms are implemented in specialized software that enables preliminary data preparation."
        }
      ]
    },
    {
      "risk": "Fluorescence interference in Raman spectroscopy.",
      "mitigation": "Use optical filters and select appropriate excitation wavelengths to minimize fluorescence effects.",
      "citations": [
        {
          "source_id": "S01",
          "page": 11,
          "supports": "Fluorescence can complicate Raman measurements, requiring specialized optical filters."
        }
      ]
    }
  ],
  "feasibility_plan": {
    "objective": "To evaluate the effectiveness of NIR and Raman spectroscopy for in-line monitoring of fat and protein in concentrated milk.",
    "samples_or_process_states": [
      "Concentrated milk product at various stages of processing."
    ],
    "reference_measurements": [
      "Laboratory analysis of fat and protein content."
    ],
    "comparisons": [
      "Compare in-line NIR and Raman results with laboratory measurements."
    ],
    "steps": [
      "Install NIR and Raman probes in the processing line.",
      "Collect spectral data during production.",
      "Analyze data using chemometric models.",
      "Compare results with laboratory measurements."
    ],
    "go_no_go_basis": "Agreement with laboratory measurements within acceptable accuracy and precision limits."
  },
  "source_conflicts": [],
  "meta": {
    "model": "gpt-4o",
    "kb_version": "kb-e5505ad92bbc",
    "generated_at": "2026-10-17T09:14:35.539990+00:00",
    "verification": {
      "citations_ok": true,
      "range_check_ok": true,
      "unsupported_numbers": [],
      "warnings": []
    }
  }
}
